# decode-dimms version $Revision$

Memory Serial Presence Detect Decoder
By Philip Edelbrock, Christian Zuckschwerdt, Burkart Lingner,
Jean Delvare, Trent Piepho and others


Decoding EEPROM: /sys/bus/i2c/drivers/eeprom/0-0050
Guessing DIMM is in                              bank 1

---=== SPD EEPROM Information ===---
EEPROM CRC of bytes 0-116                        OK (0x8F6F)
# of bytes written to SDRAM EEPROM               176
Total number of bytes in EEPROM                  256
Fundamental Memory type                          DDR3 SDRAM
Module Type                                      UDIMM

---=== Memory Characteristics ===---
Maximum module speed                             1600 MHz (PC3-12800)
Size                                             8192 MB
Banks x Rows x Columns x Bits                    8 x 16 x 10 x 64
Ranks                                            2
SDRAM Device Width                               8 bits
Bus Width Extension                              0 bits
tCL-tRCD-tRP-tRAS                                11-11-11-28
Supported CAS Latencies (tCL)                    11T, 10T, 9T, 8T, 7T, 6T

---=== Timings at Standard Speeds ===---
tCL-tRCD-tRP-tRAS as DDR3-1600                   11-11-11-28
tCL-tRCD-tRP-tRAS as DDR3-1333                   9-9-9-24
tCL-tRCD-tRP-tRAS as DDR3-1066                   7-7-7-19
tCL-tRCD-tRP-tRAS as DDR3-800                    6-6-6-14

---=== Timing Parameters ===---
Minimum Cycle Time (tCK)                         1.250 ns
Minimum CAS Latency Time (tAA)                   13.125 ns
Minimum Write Recovery time (tWR)                15.000 ns
Minimum RAS# to CAS# Delay (tRCD)                13.125 ns
Minimum Row Active to Row Active Delay (tRRD)    6.000 ns
Minimum Row Precharge Delay (tRP)                13.125 ns
Minimum Active to Precharge Delay (tRAS)         35.000 ns
Minimum Active to Auto-Refresh Delay (tRC)       48.125 ns
Minimum Recovery Delay (tRFC)                    300.000 ns
Minimum Write to Read CMD Delay (tWTR)           7.500 ns
Minimum Read to Pre-charge CMD Delay (tRTP)      7.500 ns
Minimum Four Activate Window Delay (tFAW)        30.000 ns

---=== Optional Features ===---
Operable voltages                                1.5V
RZQ/6 supported?                                 No
RZQ/7 supported?                                 Yes
DLL-Off Mode supported?                          Yes
Operating temperature range                      0-95 degrees C
Refresh Rate in extended temp range              2X
Auto Self-Refresh?                               Yes
On-Die Thermal Sensor readout?                   No
Partial Array Self-Refresh?                      No
Module Thermal Sensor                            No
SDRAM Device Type                                Standard Monolithic

---=== Physical Characteristics ===---
Module Height                                    30 mm
Module Thickness                                 2 mm front, 2 mm back
Module Width                                     133.35 mm
Module Reference Card                            B revision 0
Rank 1 Mapping                                   Mirrored

---=== Manufacturer Data ===---
Module Manufacturer                              Crucial Technology
DRAM Manufacturer                                Micron Technology
Manufacturing Location Code                      0x08
Assembly Serial Number                           0x74370000
Part Number                                      CT102464BA160B.C16
Revision Code                                    0x0100


Decoding EEPROM: /sys/bus/i2c/drivers/eeprom/0-0052
Guessing DIMM is in                              bank 3

---=== SPD EEPROM Information ===---
EEPROM CRC of bytes 0-116                        OK (0x8F6F)
# of bytes written to SDRAM EEPROM               176
Total number of bytes in EEPROM                  256
Fundamental Memory type                          DDR3 SDRAM
Module Type                                      UDIMM

---=== Memory Characteristics ===---
Maximum module speed                             1600 MHz (PC3-12800)
Size                                             8192 MB
Banks x Rows x Columns x Bits                    8 x 16 x 10 x 64
Ranks                                            2
SDRAM Device Width                               8 bits
Bus Width Extension                              0 bits
tCL-tRCD-tRP-tRAS                                11-11-11-28
Supported CAS Latencies (tCL)                    11T, 10T, 9T, 8T, 7T, 6T

---=== Timings at Standard Speeds ===---
tCL-tRCD-tRP-tRAS as DDR3-1600                   11-11-11-28
tCL-tRCD-tRP-tRAS as DDR3-1333                   9-9-9-24
tCL-tRCD-tRP-tRAS as DDR3-1066                   7-7-7-19
tCL-tRCD-tRP-tRAS as DDR3-800                    6-6-6-14

---=== Timing Parameters ===---
Minimum Cycle Time (tCK)                         1.250 ns
Minimum CAS Latency Time (tAA)                   13.125 ns
Minimum Write Recovery time (tWR)                15.000 ns
Minimum RAS# to CAS# Delay (tRCD)                13.125 ns
Minimum Row Active to Row Active Delay (tRRD)    6.000 ns
Minimum Row Precharge Delay (tRP)                13.125 ns
Minimum Active to Precharge Delay (tRAS)         35.000 ns
Minimum Active to Auto-Refresh Delay (tRC)       48.125 ns
Minimum Recovery Delay (tRFC)                    300.000 ns
Minimum Write to Read CMD Delay (tWTR)           7.500 ns
Minimum Read to Pre-charge CMD Delay (tRTP)      7.500 ns
Minimum Four Activate Window Delay (tFAW)        30.000 ns

---=== Optional Features ===---
Operable voltages                                1.5V
RZQ/6 supported?                                 No
RZQ/7 supported?                                 Yes
DLL-Off Mode supported?                          Yes
Operating temperature range                      0-95 degrees C
Refresh Rate in extended temp range              2X
Auto Self-Refresh?                               Yes
On-Die Thermal Sensor readout?                   No
Partial Array Self-Refresh?                      No
Module Thermal Sensor                            No
SDRAM Device Type                                Standard Monolithic

---=== Physical Characteristics ===---
Module Height                                    30 mm
Module Thickness                                 2 mm front, 2 mm back
Module Width                                     133.35 mm
Module Reference Card                            B revision 0
Rank 1 Mapping                                   Mirrored

---=== Manufacturer Data ===---
Module Manufacturer                              Crucial Technology
DRAM Manufacturer                                Micron Technology
Manufacturing Location Code                      0x08
Assembly Serial Number                           0x81820000
Part Number                                      CT102464BA160B.C16
Revision Code                                    0x0100


Number of SDRAM DIMMs detected and decoded: 2
