smartctl 7.0 2018-12-30 r4883 [x86_64-linux-5.0.5-1-MANJARO] (local build)
Copyright (C) 2002-18, Bruce Allen, Christian Franke, www.smartmontools.org

=== START OF INFORMATION SECTION ===
Model Family:     Seagate Momentus 7200.5
Device Model:     ST9750420AS
Serial Number:    6WS3155L
LU WWN Device Id: 5 000c50 0614757a2
Firmware Version: 0001SDM5
User Capacity:    750,156,374,016 bytes [750 GB]
Sector Sizes:     512 bytes logical, 4096 bytes physical
Rotation Rate:    7200 rpm
Device is:        In smartctl database [for details use: -P show]
ATA Version is:   ATA8-ACS T13/1699-D revision 4
SATA Version is:  SATA 2.6, 3.0 Gb/s
Local Time is:    Wed Apr 17 08:33:26 2019 CEST
SMART support is: Available - device has SMART capability.
SMART support is: Enabled
AAM feature is:   Unavailable
APM level is:     254 (maximum performance)
Rd look-ahead is: Enabled
Write cache is:   Enabled
DSN feature is:   Unavailable
ATA Security is:  Disabled, frozen [SEC2]
Wt Cache Reorder: Enabled

=== START OF READ SMART DATA SECTION ===
SMART overall-health self-assessment test result: PASSED
See vendor-specific Attribute list for marginal Attributes.

General SMART Values:
Offline data collection status:  (0x82)	Offline data collection activity
					was completed without error.
					Auto Offline Data Collection: Enabled.
Self-test execution status:      (   0)	The previous self-test routine completed
					without error or no self-test has ever 
					been run.
Total time to complete Offline 
data collection: 		(    0) seconds.
Offline data collection
capabilities: 			 (0x7b) SMART execute Offline immediate.
					Auto Offline data collection on/off support.
					Suspend Offline collection upon new
					command.
					Offline surface scan supported.
					Self-test supported.
					Conveyance Self-test supported.
					Selective Self-test supported.
SMART capabilities:            (0x0003)	Saves SMART data before entering
					power-saving mode.
					Supports SMART auto save timer.
Error logging capability:        (0x01)	Error logging supported.
					General Purpose Logging supported.
Short self-test routine 
recommended polling time: 	 (   2) minutes.
Extended self-test routine
recommended polling time: 	 ( 145) minutes.
Conveyance self-test routine
recommended polling time: 	 (   3) minutes.
SCT capabilities: 	       (0x303f)	SCT Status supported.
					SCT Error Recovery Control supported.
					SCT Feature Control supported.
					SCT Data Table supported.

SMART Attributes Data Structure revision number: 10
Vendor Specific SMART Attributes with Thresholds:
ID# ATTRIBUTE_NAME          FLAGS    VALUE WORST THRESH FAIL RAW_VALUE
  1 Raw_Read_Error_Rate     POSR--   119   099   006    -    206410160
  3 Spin_Up_Time            PO----   098   097   085    -    0
  4 Start_Stop_Count        -O--CK   099   099   020    -    1940
  5 Reallocated_Sector_Ct   PO--CK   100   100   036    -    0
  7 Seek_Error_Rate         POSR--   074   060   030    -    27414184
  9 Power_On_Hours          -O--CK   098   098   000    -    2017
 10 Spin_Retry_Count        PO--C-   100   100   097    -    0
 12 Power_Cycle_Count       -O--CK   100   100   020    -    966
184 End-to-End_Error        -O--CK   100   100   099    -    0
187 Reported_Uncorrect      -O--CK   100   100   000    -    0
188 Command_Timeout         -O--CK   100   100   000    -    1
189 High_Fly_Writes         -O-RCK   100   100   000    -    0
190 Airflow_Temperature_Cel -O---K   071   043   045    Past 29 (0 2 29 24 0)
191 G-Sense_Error_Rate      -O--CK   100   100   000    -    11
192 Power-Off_Retract_Count -O--CK   100   100   000    -    164
193 Load_Cycle_Count        -O--CK   018   018   000    -    164806
194 Temperature_Celsius     -O---K   029   057   000    -    29 (0 19 0 0 0)
195 Hardware_ECC_Recovered  -O-RC-   119   099   000    -    206410160
197 Current_Pending_Sector  -O--C-   100   100   000    -    0
198 Offline_Uncorrectable   ----C-   100   100   000    -    0
199 UDMA_CRC_Error_Count    -OSRCK   200   200   000    -    0
240 Head_Flying_Hours       ------   100   253   000    -    1103 (11 165 0)
241 Total_LBAs_Written      ------   100   253   000    -    2988175193
242 Total_LBAs_Read         ------   100   253   000    -    711974475
254 Free_Fall_Sensor        -O--CK   100   100   000    -    0
                            ||||||_ K auto-keep
                            |||||__ C event count
                            ||||___ R error rate
                            |||____ S speed/performance
                            ||_____ O updated online
                            |______ P prefailure warning

General Purpose Log Directory Version 1
SMART           Log Directory Version 1 [multi-sector log support]
Address    Access  R/W   Size  Description
0x00       GPL,SL  R/O      1  Log Directory
0x01       GPL,SL  R/O      1  Summary SMART error log
0x02       GPL,SL  R/O      5  Comprehensive SMART error log
0x03       GPL     R/O      5  Ext. Comprehensive SMART error log
0x06       GPL,SL  R/O      1  SMART self-test log
0x07       GPL     R/O      1  Extended self-test log
0x09       GPL,SL  R/W      1  Selective self-test log
0x10       GPL     R/O      1  NCQ Command Error log
0x11       GPL     R/O      1  SATA Phy Event Counters log
0x21       GPL     R/O      1  Write stream error log
0x22       GPL     R/O      1  Read stream error log
0x80-0x9f  GPL,SL  R/W     16  Host vendor specific log
0xa1       GPL,SL  VS      20  Device vendor specific log
0xa2       GPL     VS    2248  Device vendor specific log
0xa8       GPL,SL  VS      65  Device vendor specific log
0xa9       GPL,SL  VS       1  Device vendor specific log
0xab       GPL     VS       1  Device vendor specific log
0xae       GPL     VS       1  Device vendor specific log
0xb0       GPL     VS    2864  Device vendor specific log
0xbd       GPL     VS     252  Device vendor specific log
0xbe-0xbf  GPL     VS   65535  Device vendor specific log
0xe0       GPL,SL  R/W      1  SCT Command/Status
0xe1       GPL,SL  R/W      1  SCT Data Transfer

SMART Extended Comprehensive Error Log Version: 1 (5 sectors)
No Errors Logged

SMART Extended Self-test Log Version: 1 (1 sectors)
No self-tests have been logged.  [To run self-tests, use: smartctl -t]

SMART Selective self-test log data structure revision number 1
 SPAN  MIN_LBA  MAX_LBA  CURRENT_TEST_STATUS
    1        0        0  Not_testing
    2        0        0  Not_testing
    3        0        0  Not_testing
    4        0        0  Not_testing
    5        0        0  Not_testing
Selective self-test flags (0x0):
  After scanning selected spans, do NOT read-scan remainder of disk.
If Selective self-test is pending on power-up, resume after 0 minute delay.

SCT Status Version:                  3
SCT Version (vendor specific):       522 (0x020a)
Device State:                        Active (0)
Current Temperature:                    28 Celsius
Power Cycle Min/Max Temperature:     24/28 Celsius
Lifetime    Min/Max Temperature:     19/57 Celsius
Specified Max Operating Temperature:    36 Celsius
Under/Over Temperature Limit Count:   0/0

SCT Temperature History Version:     2
Temperature Sampling Period:         1 minute
Temperature Logging Interval:        30 minutes
Min/Max recommended Temperature:     14/55 Celsius
Min/Max Temperature Limit:           10/60 Celsius
Temperature History Size (Index):    128 (72)

Index    Estimated Time   Temperature Celsius
  73    2019-04-14 17:00    32  *************
  74    2019-04-14 17:30     ?  -
  75    2019-04-14 18:00    24  *****
  76    2019-04-14 18:30    30  ***********
  77    2019-04-14 19:00    31  ************
 ...    ..(  4 skipped).    ..  ************
  82    2019-04-14 21:30    31  ************
  83    2019-04-14 22:00    30  ***********
  84    2019-04-14 22:30    30  ***********
  85    2019-04-14 23:00    31  ************
  86    2019-04-14 23:30    31  ************
  87    2019-04-15 00:00     ?  -
  88    2019-04-15 00:30    24  *****
  89    2019-04-15 01:00    30  ***********
  90    2019-04-15 01:30    31  ************
 ...    ..(  3 skipped).    ..  ************
  94    2019-04-15 03:30    31  ************
  95    2019-04-15 04:00     ?  -
  96    2019-04-15 04:30    26  *******
  97    2019-04-15 05:00    42  ***********************
  98    2019-04-15 05:30    39  ********************
  99    2019-04-15 06:00    34  ***************
 100    2019-04-15 06:30    33  **************
 101    2019-04-15 07:00    33  **************
 102    2019-04-15 07:30    34  ***************
 103    2019-04-15 08:00     ?  -
 104    2019-04-15 08:30    24  *****
 105    2019-04-15 09:00    31  ************
 106    2019-04-15 09:30    31  ************
 107    2019-04-15 10:00    31  ************
 108    2019-04-15 10:30    32  *************
 109    2019-04-15 11:00    31  ************
 110    2019-04-15 11:30    31  ************
 111    2019-04-15 12:00    32  *************
 112    2019-04-15 12:30    32  *************
 113    2019-04-15 13:00    33  **************
 114    2019-04-15 13:30    32  *************
 115    2019-04-15 14:00    33  **************
 116    2019-04-15 14:30    32  *************
 117    2019-04-15 15:00    32  *************
 118    2019-04-15 15:30    31  ************
 119    2019-04-15 16:00    39  ********************
 120    2019-04-15 16:30    40  *********************
 121    2019-04-15 17:00    33  **************
 122    2019-04-15 17:30    32  *************
 123    2019-04-15 18:00     ?  -
 124    2019-04-15 18:30    24  *****
 125    2019-04-15 19:00    34  ***************
 126    2019-04-15 19:30    35  ****************
 127    2019-04-15 20:00    42  ***********************
   0    2019-04-15 20:30    42  ***********************
   1    2019-04-15 21:00    42  ***********************
   2    2019-04-15 21:30     ?  -
   3    2019-04-15 22:00    24  *****
   4    2019-04-15 22:30     ?  -
   5    2019-04-15 23:00    24  *****
   6    2019-04-15 23:30    40  *********************
   7    2019-04-16 00:00    33  **************
   8    2019-04-16 00:30    32  *************
   9    2019-04-16 01:00     ?  -
  10    2019-04-16 01:30    25  ******
  11    2019-04-16 02:00     ?  -
  12    2019-04-16 02:30    25  ******
  13    2019-04-16 03:00     ?  -
  14    2019-04-16 03:30    37  ******************
  15    2019-04-16 04:00    40  *********************
  16    2019-04-16 04:30    41  **********************
  17    2019-04-16 05:00    31  ************
  18    2019-04-16 05:30    29  **********
  19    2019-04-16 06:00     ?  -
  20    2019-04-16 06:30    24  *****
  21    2019-04-16 07:00    40  *********************
  22    2019-04-16 07:30    42  ***********************
  23    2019-04-16 08:00    33  **************
  24    2019-04-16 08:30    32  *************
 ...    ..(  3 skipped).    ..  *************
  28    2019-04-16 10:30    32  *************
  29    2019-04-16 11:00    40  *********************
  30    2019-04-16 11:30    46  ***************************
  31    2019-04-16 12:00     ?  -
  32    2019-04-16 12:30    24  *****
  33    2019-04-16 13:00    34  ***************
  34    2019-04-16 13:30    32  *************
  35    2019-04-16 14:00    32  *************
  36    2019-04-16 14:30    36  *****************
  37    2019-04-16 15:00     ?  -
  38    2019-04-16 15:30    24  *****
  39    2019-04-16 16:00    32  *************
  40    2019-04-16 16:30    36  *****************
  41    2019-04-16 17:00    31  ************
  42    2019-04-16 17:30     ?  -
  43    2019-04-16 18:00    24  *****
  44    2019-04-16 18:30    31  ************
 ...    ..(  2 skipped).    ..  ************
  47    2019-04-16 20:00    31  ************
  48    2019-04-16 20:30    32  *************
  49    2019-04-16 21:00     ?  -
  50    2019-04-16 21:30    32  *************
  51    2019-04-16 22:00     ?  -
  52    2019-04-16 22:30    32  *************
  53    2019-04-16 23:00     ?  -
  54    2019-04-16 23:30    32  *************
  55    2019-04-17 00:00     ?  -
  56    2019-04-17 00:30    32  *************
  57    2019-04-17 01:00     ?  -
  58    2019-04-17 01:30    32  *************
  59    2019-04-17 02:00    32  *************
  60    2019-04-17 02:30    33  **************
  61    2019-04-17 03:00     ?  -
  62    2019-04-17 03:30    24  *****
  63    2019-04-17 04:00     ?  -
  64    2019-04-17 04:30    24  *****
  65    2019-04-17 05:00     ?  -
  66    2019-04-17 05:30    24  *****
  67    2019-04-17 06:00     ?  -
  68    2019-04-17 06:30    24  *****
  69    2019-04-17 07:00     ?  -
  70    2019-04-17 07:30    24  *****
  71    2019-04-17 08:00     ?  -
  72    2019-04-17 08:30    24  *****

SCT Error Recovery Control:
           Read: Disabled
          Write: Disabled

Device Statistics (GP/SMART Log 0x04) not supported

Pending Defects log (GP Log 0x0c) not supported

SATA Phy Event Counters (GP Log 0x11)
ID      Size     Value  Description
0x000a  2            4  Device-to-host register FISes sent due to a COMRESET
0x0001  2            0  Command failed due to ICRC error
0x0003  2            0  R_ERR response for device-to-host data FIS
0x0004  2            0  R_ERR response for host-to-device data FIS
0x0006  2            0  R_ERR response for device-to-host non-data FIS
0x0007  2            0  R_ERR response for host-to-device non-data FIS

