smartctl 6.5 2016-01-24 r4214 [x86_64-linux-4.15.0-72-generic] (local build)
Copyright (C) 2002-16, Bruce Allen, Christian Franke, www.smartmontools.org

=== START OF INFORMATION SECTION ===
Model Family:     Toshiba 2.5" HDD MQ01ABF...
Device Model:     TOSHIBA MQ01ABF050
Serial Number:    76H3EUCL
LU WWN Device Id: 5 000039 7222954ce
Firmware Version: AM0B1J
User Capacity:    500.107.862.016 bytes [500 GB]
Sector Sizes:     512 bytes logical, 4096 bytes physical
Rotation Rate:    5400 rpm
Form Factor:      2.5 inches
Device is:        In smartctl database [for details use: -P show]
ATA Version is:   ATA8-ACS (minor revision not indicated)
SATA Version is:  SATA 3.0, 6.0 Gb/s (current: 6.0 Gb/s)
Local Time is:    Thu Dec 19 20:41:19 2019 CET
SMART support is: Available - device has SMART capability.
SMART support is: Enabled
AAM feature is:   Unavailable
APM level is:     254 (maximum performance)
Rd look-ahead is: Enabled
Write cache is:   Enabled
ATA Security is:  Disabled, NOT FROZEN [SEC1]
Wt Cache Reorder: Enabled

=== START OF READ SMART DATA SECTION ===
SMART overall-health self-assessment test result: PASSED

General SMART Values:
Offline data collection status:  (0x00)	Offline data collection activity
					was never started.
					Auto Offline Data Collection: Disabled.
Self-test execution status:      (   0)	The previous self-test routine completed
					without error or no self-test has ever 
					been run.
Total time to complete Offline 
data collection: 		(  120) seconds.
Offline data collection
capabilities: 			 (0x5b) SMART execute Offline immediate.
					Auto Offline data collection on/off support.
					Suspend Offline collection upon new
					command.
					Offline surface scan supported.
					Self-test supported.
					No Conveyance Self-test supported.
					Selective Self-test supported.
SMART capabilities:            (0x0003)	Saves SMART data before entering
					power-saving mode.
					Supports SMART auto save timer.
Error logging capability:        (0x01)	Error logging supported.
					General Purpose Logging supported.
Short self-test routine 
recommended polling time: 	 (   2) minutes.
Extended self-test routine
recommended polling time: 	 ( 121) minutes.
SCT capabilities: 	       (0x003d)	SCT Status supported.
					SCT Error Recovery Control supported.
					SCT Feature Control supported.
					SCT Data Table supported.

SMART Attributes Data Structure revision number: 16
Vendor Specific SMART Attributes with Thresholds:
ID# ATTRIBUTE_NAME          FLAGS    VALUE WORST THRESH FAIL RAW_VALUE
  1 Raw_Read_Error_Rate     PO-R--   100   100   050    -    0
  2 Throughput_Performance  P-S---   100   100   050    -    0
  3 Spin_Up_Time            POS--K   100   100   001    -    1268
  4 Start_Stop_Count        -O--CK   100   100   000    -    9310
  5 Reallocated_Sector_Ct   PO--CK   100   100   050    -    0
  7 Seek_Error_Rate         PO-R--   100   100   050    -    0
  8 Seek_Time_Performance   P-S---   100   100   050    -    0
  9 Power_On_Hours          -O--CK   091   091   000    -    3990
 10 Spin_Retry_Count        PO--CK   253   100   030    -    0
 12 Power_Cycle_Count       -O--CK   100   100   000    -    3178
191 G-Sense_Error_Rate      -O--CK   100   100   000    -    1501
192 Power-Off_Retract_Count -O--CK   100   100   000    -    62
193 Load_Cycle_Count        -O--CK   086   086   000    -    148398
194 Temperature_Celsius     -O---K   100   100   000    -    28 (Min/Max 13/44)
196 Reallocated_Event_Count -O--CK   100   100   000    -    0
197 Current_Pending_Sector  -O--CK   100   100   000    -    0
198 Offline_Uncorrectable   ----CK   100   100   000    -    0
199 UDMA_CRC_Error_Count    -O--CK   200   200   000    -    2945
220 Disk_Shift              -O----   100   100   000    -    0
222 Loaded_Hours            -O--CK   092   092   000    -    3421
223 Load_Retry_Count        -O--CK   100   100   000    -    0
224 Load_Friction           -O---K   100   100   000    -    0
226 Load-in_Time            -OS--K   100   100   000    -    197
240 Head_Flying_Hours       P-----   100   100   001    -    0
                            ||||||_ K auto-keep
                            |||||__ C event count
                            ||||___ R error rate
                            |||____ S speed/performance
                            ||_____ O updated online
                            |______ P prefailure warning

General Purpose Log Directory Version 1
SMART           Log Directory Version 1 [multi-sector log support]
Address    Access  R/W   Size  Description
0x00       GPL,SL  R/O      1  Log Directory
0x01           SL  R/O      1  Summary SMART error log
0x02           SL  R/O     51  Comprehensive SMART error log
0x03       GPL     R/O     64  Ext. Comprehensive SMART error log
0x04       GPL,SL  R/O      8  Device Statistics log
0x06           SL  R/O      1  SMART self-test log
0x07       GPL     R/O      1  Extended self-test log
0x09           SL  R/W      1  Selective self-test log
0x10       GPL     R/O      1  SATA NCQ Queued Error log
0x11       GPL     R/O      1  SATA Phy Event Counters log
0x80-0x9f  GPL,SL  R/W     16  Host vendor specific log
0xe0       GPL,SL  R/W      1  SCT Command/Status
0xe1       GPL,SL  R/W      1  SCT Data Transfer

SMART Extended Comprehensive Error Log Version: 1 (64 sectors)
Device Error Count: 2945 (device log contains only the most recent 256 errors)
	CR     = Command Register
	FEATR  = Features Register
	COUNT  = Count (was: Sector Count) Register
	LBA_48 = Upper bytes of LBA High/Mid/Low Registers ]  ATA-8
	LH     = LBA High (was: Cylinder High) Register    ]   LBA
	LM     = LBA Mid (was: Cylinder Low) Register      ] Register
	LL     = LBA Low (was: Sector Number) Register     ]
	DV     = Device (was: Device/Head) Register
	DC     = Device Control Register
	ER     = Error register
	ST     = Status register
Powered_Up_Time is measured from power on, and printed as
DDd+hh:mm:SS.sss where DD=days, hh=hours, mm=minutes,
SS=sec, and sss=millisec. It "wraps" after 49.710 days.

Error 2945 [128] occurred at disk power-on lifetime: 1952 hours (81 days + 8 hours)
  When the command that caused the error occurred, the device was active or idle.

  After command completion occurred, registers were:
  ER -- ST COUNT  LBA_48  LH LM LL DV DC
  -- -- -- == -- == == == -- -- -- -- --
  84 -- 41 00 f8 00 00 01 4c 62 a7 40 00  Error: ICRC, ABRT at LBA = 0x014c62a7 = 21783207

  Commands leading to the command that caused the error were:
  CR FEATR COUNT  LBA_48  LH LM LL DV DC  Powered_Up_Time  Command/Feature_Name
  -- == -- == -- == == == -- -- -- -- --  ---------------  --------------------
  61 00 18 00 f8 00 00 01 4c 62 90 40 00     00:04:08.657  WRITE FPDMA QUEUED
  60 00 a0 00 f0 00 00 01 36 7a f8 40 00     00:04:08.657  READ FPDMA QUEUED
  60 00 1c 00 e8 00 00 01 19 19 47 40 00     00:04:08.657  READ FPDMA QUEUED
  60 00 08 00 e0 00 00 00 6d cd a8 40 00     00:04:08.657  READ FPDMA QUEUED
  60 00 1c 00 d8 00 00 00 bc 3d 11 40 00     00:04:08.657  READ FPDMA QUEUED

Error 2944 [127] occurred at disk power-on lifetime: 1952 hours (81 days + 8 hours)
  When the command that caused the error occurred, the device was active or idle.

  After command completion occurred, registers were:
  ER -- ST COUNT  LBA_48  LH LM LL DV DC
  -- -- -- == -- == == == -- -- -- -- --
  84 -- 41 00 20 00 00 01 f5 7f ef 40 00  Error: ICRC, ABRT at LBA = 0x01f57fef = 32866287

  Commands leading to the command that caused the error were:
  CR FEATR COUNT  LBA_48  LH LM LL DV DC  Powered_Up_Time  Command/Feature_Name
  -- == -- == -- == == == -- -- -- -- --  ---------------  --------------------
  61 01 00 00 28 00 00 01 f5 7d f0 40 00     00:03:56.027  WRITE FPDMA QUEUED
  61 01 00 00 20 00 00 01 f5 7e f0 40 00     00:03:56.025  WRITE FPDMA QUEUED
  60 01 00 00 18 00 00 01 3e c0 70 40 00     00:03:56.025  READ FPDMA QUEUED
  60 00 f8 00 10 00 00 01 3e bf 78 40 00     00:03:56.025  READ FPDMA QUEUED
  61 00 d8 00 08 00 00 01 f5 7f f0 40 00     00:03:56.024  WRITE FPDMA QUEUED

Error 2943 [126] occurred at disk power-on lifetime: 1952 hours (81 days + 8 hours)
  When the command that caused the error occurred, the device was active or idle.

  After command completion occurred, registers were:
  ER -- ST COUNT  LBA_48  LH LM LL DV DC
  -- -- -- == -- == == == -- -- -- -- --
  84 -- 41 00 c0 00 00 01 f5 79 ef 40 00  Error: ICRC, ABRT at LBA = 0x01f579ef = 32864751

  Commands leading to the command that caused the error were:
  CR FEATR COUNT  LBA_48  LH LM LL DV DC  Powered_Up_Time  Command/Feature_Name
  -- == -- == -- == == == -- -- -- -- --  ---------------  --------------------
  61 00 d8 00 f8 00 00 01 f5 7f f0 40 00     00:03:55.620  WRITE FPDMA QUEUED
  61 01 00 00 f0 00 00 01 f5 7e f0 40 00     00:03:55.620  WRITE FPDMA QUEUED
  61 01 00 00 e8 00 00 01 f5 7d f0 40 00     00:03:55.620  WRITE FPDMA QUEUED
  61 01 00 00 e0 00 00 01 f5 7c f0 40 00     00:03:55.620  WRITE FPDMA QUEUED
  61 01 00 00 d8 00 00 01 f5 7b f0 40 00     00:03:55.620  WRITE FPDMA QUEUED

Error 2942 [125] occurred at disk power-on lifetime: 1952 hours (81 days + 8 hours)
  When the command that caused the error occurred, the device was active or idle.

  After command completion occurred, registers were:
  ER -- ST COUNT  LBA_48  LH LM LL DV DC
  -- -- -- == -- == == == -- -- -- -- --
  84 -- 41 00 08 00 00 01 f5 47 cf 40 00  Error: ICRC, ABRT at LBA = 0x01f547cf = 32851919

  Commands leading to the command that caused the error were:
  CR FEATR COUNT  LBA_48  LH LM LL DV DC  Powered_Up_Time  Command/Feature_Name
  -- == -- == -- == == == -- -- -- -- --  ---------------  --------------------
  61 00 98 00 08 00 00 01 f5 47 38 40 00     00:03:54.827  WRITE FPDMA QUEUED
  60 00 1a 00 00 00 00 01 66 4e 30 40 00     00:03:54.825  READ FPDMA QUEUED
  60 00 08 00 f8 00 00 00 6b 9d 20 40 00     00:03:54.825  READ FPDMA QUEUED
  60 00 80 00 f0 00 00 01 08 82 f8 40 00     00:03:54.816  READ FPDMA QUEUED
  60 00 08 00 e8 00 00 01 66 48 10 40 00     00:03:54.811  READ FPDMA QUEUED

Error 2941 [124] occurred at disk power-on lifetime: 1952 hours (81 days + 8 hours)
  When the command that caused the error occurred, the device was active or idle.

  After command completion occurred, registers were:
  ER -- ST COUNT  LBA_48  LH LM LL DV DC
  -- -- -- == -- == == == -- -- -- -- --
  84 -- 41 00 80 00 00 04 60 f6 bf 40 00  Error: ICRC, ABRT at LBA = 0x0460f6bf = 73463487

  Commands leading to the command that caused the error were:
  CR FEATR COUNT  LBA_48  LH LM LL DV DC  Powered_Up_Time  Command/Feature_Name
  -- == -- == -- == == == -- -- -- -- --  ---------------  --------------------
  61 01 00 00 80 00 00 04 60 f5 c0 40 00     00:03:51.822  WRITE FPDMA QUEUED
  60 00 60 00 78 00 00 01 cf 48 78 40 00     00:03:51.822  READ FPDMA QUEUED
  61 01 00 00 70 00 00 04 60 f6 c0 40 00     00:03:51.822  WRITE FPDMA QUEUED
  60 00 08 00 68 00 00 00 6a f1 e0 40 00     00:03:51.822  READ FPDMA QUEUED
  61 01 00 00 60 00 00 04 60 f7 c0 40 00     00:03:51.822  WRITE FPDMA QUEUED

Error 2940 [123] occurred at disk power-on lifetime: 1952 hours (81 days + 8 hours)
  When the command that caused the error occurred, the device was active or idle.

  After command completion occurred, registers were:
  ER -- ST COUNT  LBA_48  LH LM LL DV DC
  -- -- -- == -- == == == -- -- -- -- --
  84 -- 41 00 40 00 00 01 df d6 d7 40 00  Error: ICRC, ABRT at LBA = 0x01dfd6d7 = 31446743

  Commands leading to the command that caused the error were:
  CR FEATR COUNT  LBA_48  LH LM LL DV DC  Powered_Up_Time  Command/Feature_Name
  -- == -- == -- == == == -- -- -- -- --  ---------------  --------------------
  61 01 00 00 40 00 00 01 df d5 d8 40 00     00:03:50.974  WRITE FPDMA QUEUED
  60 00 05 00 38 00 00 01 d4 31 78 40 00     00:03:50.899  READ FPDMA QUEUED
  ec 00 00 00 00 00 00 00 00 00 00 00 00     00:03:50.883  IDENTIFY DEVICE
  ef 00 03 00 45 00 00 00 00 00 00 00 00     00:03:50.868  SET FEATURES [Set transfer mode]
  ef 00 10 00 07 00 00 00 00 00 00 00 00     00:03:50.852  SET FEATURES [Enable SATA feature]

Error 2939 [122] occurred at disk power-on lifetime: 1952 hours (81 days + 8 hours)
  When the command that caused the error occurred, the device was active or idle.

  After command completion occurred, registers were:
  ER -- ST COUNT  LBA_48  LH LM LL DV DC
  -- -- -- == -- == == == -- -- -- -- --
  84 -- 41 00 90 00 00 00 6b 4c 97 40 00  Error: ICRC, ABRT at LBA = 0x006b4c97 = 7031959

  Commands leading to the command that caused the error were:
  CR FEATR COUNT  LBA_48  LH LM LL DV DC  Powered_Up_Time  Command/Feature_Name
  -- == -- == -- == == == -- -- -- -- --  ---------------  --------------------
  61 00 08 00 90 00 00 00 6b 4c 90 40 00     00:03:44.793  WRITE FPDMA QUEUED
  61 00 08 00 88 00 00 00 6b 44 90 40 00     00:03:44.793  WRITE FPDMA QUEUED
  61 00 08 00 80 00 00 00 6b 44 28 40 00     00:03:44.792  WRITE FPDMA QUEUED
  61 00 08 00 78 00 00 00 6b 43 48 40 00     00:03:44.792  WRITE FPDMA QUEUED
  61 00 08 00 70 00 00 00 6b 42 58 40 00     00:03:44.792  WRITE FPDMA QUEUED

Error 2938 [121] occurred at disk power-on lifetime: 1952 hours (81 days + 8 hours)
  When the command that caused the error occurred, the device was active or idle.

  After command completion occurred, registers were:
  ER -- ST COUNT  LBA_48  LH LM LL DV DC
  -- -- -- == -- == == == -- -- -- -- --
  84 -- 41 00 f8 00 00 00 66 64 cf 40 00  Error: ICRC, ABRT at LBA = 0x006664cf = 6710479

  Commands leading to the command that caused the error were:
  CR FEATR COUNT  LBA_48  LH LM LL DV DC  Powered_Up_Time  Command/Feature_Name
  -- == -- == -- == == == -- -- -- -- --  ---------------  --------------------
  61 00 08 00 f8 00 00 00 66 64 c8 40 00     00:03:37.414  WRITE FPDMA QUEUED
  61 00 08 00 f0 00 00 00 68 a8 80 40 00     00:03:37.412  WRITE FPDMA QUEUED
  61 00 10 00 e8 00 00 01 cc e1 68 40 00     00:03:37.412  WRITE FPDMA QUEUED
  61 00 08 00 e0 00 00 00 66 64 c0 40 00     00:03:37.412  WRITE FPDMA QUEUED
  60 00 28 00 d8 00 00 01 1d 47 2a 40 00     00:03:37.411  READ FPDMA QUEUED

SMART Extended Self-test Log Version: 1 (1 sectors)
No self-tests have been logged.  [To run self-tests, use: smartctl -t]

SMART Selective self-test log data structure revision number 1
 SPAN  MIN_LBA  MAX_LBA  CURRENT_TEST_STATUS
    1        0        0  Not_testing
    2        0        0  Not_testing
    3        0        0  Not_testing
    4        0        0  Not_testing
    5        0        0  Not_testing
Selective self-test flags (0x0):
  After scanning selected spans, do NOT read-scan remainder of disk.
If Selective self-test is pending on power-up, resume after 0 minute delay.

SCT Status Version:                  2
SCT Version (vendor specific):       1 (0x0001)
SCT Support Level:                   1
Device State:                        Active (0)
Current Temperature:                    28 Celsius
Power Cycle Min/Max Temperature:     23/28 Celsius
Lifetime    Min/Max Temperature:     13/44 Celsius
Under/Over Temperature Limit Count:   0/0

SCT Temperature History Version:     2
Temperature Sampling Period:         1 minute
Temperature Logging Interval:        1 minute
Min/Max recommended Temperature:      5/55 Celsius
Min/Max Temperature Limit:            5/55 Celsius
Temperature History Size (Index):    478 (440)

Index    Estimated Time   Temperature Celsius
 441    2019-12-19 12:44    27  ********
 442    2019-12-19 12:45    27  ********
 443    2019-12-19 12:46    27  ********
 444    2019-12-19 12:47    28  *********
 ...    ..( 17 skipped).    ..  *********
 462    2019-12-19 13:05    28  *********
 463    2019-12-19 13:06    29  **********
 ...    ..( 34 skipped).    ..  **********
  20    2019-12-19 13:41    29  **********
  21    2019-12-19 13:42     ?  -
  22    2019-12-19 13:43    21  **
  23    2019-12-19 13:44    23  ****
  24    2019-12-19 13:45    24  *****
  25    2019-12-19 13:46    26  *******
  26    2019-12-19 13:47    27  ********
  27    2019-12-19 13:48    27  ********
  28    2019-12-19 13:49    28  *********
  29    2019-12-19 13:50    28  *********
  30    2019-12-19 13:51    28  *********
  31    2019-12-19 13:52    29  **********
 ...    ..(  6 skipped).    ..  **********
  38    2019-12-19 13:59    29  **********
  39    2019-12-19 14:00     ?  -
  40    2019-12-19 14:01    27  ********
  41    2019-12-19 14:02    27  ********
  42    2019-12-19 14:03    28  *********
 ...    ..(  3 skipped).    ..  *********
  46    2019-12-19 14:07    28  *********
  47    2019-12-19 14:08    29  **********
 ...    ..(  2 skipped).    ..  **********
  50    2019-12-19 14:11    29  **********
  51    2019-12-19 14:12    30  ***********
 ...    ..( 11 skipped).    ..  ***********
  63    2019-12-19 14:24    30  ***********
  64    2019-12-19 14:25    31  ************
 ...    ..(  4 skipped).    ..  ************
  69    2019-12-19 14:30    31  ************
  70    2019-12-19 14:31    30  ***********
 ...    ..( 11 skipped).    ..  ***********
  82    2019-12-19 14:43    30  ***********
  83    2019-12-19 14:44    31  ************
 ...    ..(  4 skipped).    ..  ************
  88    2019-12-19 14:49    31  ************
  89    2019-12-19 14:50    32  *************
  90    2019-12-19 14:51    33  **************
  91    2019-12-19 14:52    33  **************
  92    2019-12-19 14:53     ?  -
  93    2019-12-19 14:54    28  *********
  94    2019-12-19 14:55    28  *********
  95    2019-12-19 14:56    29  **********
  96    2019-12-19 14:57    30  ***********
  97    2019-12-19 14:58    30  ***********
  98    2019-12-19 14:59    30  ***********
  99    2019-12-19 15:00    31  ************
 100    2019-12-19 15:01    31  ************
 101    2019-12-19 15:02    32  *************
 102    2019-12-19 15:03    32  *************
 103    2019-12-19 15:04    32  *************
 104    2019-12-19 15:05    33  **************
 ...    ..( 11 skipped).    ..  **************
 116    2019-12-19 15:17    33  **************
 117    2019-12-19 15:18    32  *************
 ...    ..(  7 skipped).    ..  *************
 125    2019-12-19 15:26    32  *************
 126    2019-12-19 15:27    31  ************
 ...    ..( 47 skipped).    ..  ************
 174    2019-12-19 16:15    31  ************
 175    2019-12-19 16:16    30  ***********
 ...    ..( 10 skipped).    ..  ***********
 186    2019-12-19 16:27    30  ***********
 187    2019-12-19 16:28    31  ************
 ...    ..(  2 skipped).    ..  ************
 190    2019-12-19 16:31    31  ************
 191    2019-12-19 16:32    30  ***********
 ...    ..(  5 skipped).    ..  ***********
 197    2019-12-19 16:38    30  ***********
 198    2019-12-19 16:39    31  ************
 ...    ..(  5 skipped).    ..  ************
 204    2019-12-19 16:45    31  ************
 205    2019-12-19 16:46     ?  -
 206    2019-12-19 16:47    20  *
 207    2019-12-19 16:48    21  **
 208    2019-12-19 16:49    22  ***
 209    2019-12-19 16:50    23  ****
 210    2019-12-19 16:51    24  *****
 211    2019-12-19 16:52    24  *****
 212    2019-12-19 16:53    25  ******
 213    2019-12-19 16:54    26  *******
 214    2019-12-19 16:55    26  *******
 215    2019-12-19 16:56    27  ********
 ...    ..(  2 skipped).    ..  ********
 218    2019-12-19 16:59    27  ********
 219    2019-12-19 17:00    28  *********
 ...    ..( 24 skipped).    ..  *********
 244    2019-12-19 17:25    28  *********
 245    2019-12-19 17:26    29  **********
 ...    ..( 22 skipped).    ..  **********
 268    2019-12-19 17:49    29  **********
 269    2019-12-19 17:50     ?  -
 270    2019-12-19 17:51     ?  -
 271    2019-12-19 17:52    21  **
 272    2019-12-19 17:53    22  ***
 273    2019-12-19 17:54    24  *****
 274    2019-12-19 17:55    25  ******
 275    2019-12-19 17:56    26  *******
 276    2019-12-19 17:57    27  ********
 277    2019-12-19 17:58    28  *********
 278    2019-12-19 17:59    29  **********
 279    2019-12-19 18:00    29  **********
 280    2019-12-19 18:01    30  ***********
 281    2019-12-19 18:02    30  ***********
 282    2019-12-19 18:03    31  ************
 283    2019-12-19 18:04    32  *************
 284    2019-12-19 18:05    32  *************
 285    2019-12-19 18:06    33  **************
 ...    ..(  6 skipped).    ..  **************
 292    2019-12-19 18:13    33  **************
 293    2019-12-19 18:14    32  *************
 294    2019-12-19 18:15    32  *************
 295    2019-12-19 18:16    33  **************
 ...    ..(  8 skipped).    ..  **************
 304    2019-12-19 18:25    33  **************
 305    2019-12-19 18:26    34  ***************
 ...    ..( 22 skipped).    ..  ***************
 328    2019-12-19 18:49    34  ***************
 329    2019-12-19 18:50     ?  -
 330    2019-12-19 18:51    27  ********
 331    2019-12-19 18:52    27  ********
 332    2019-12-19 18:53    28  *********
 ...    ..( 14 skipped).    ..  *********
 347    2019-12-19 19:08    28  *********
 348    2019-12-19 19:09    29  **********
 349    2019-12-19 19:10    29  **********
 350    2019-12-19 19:11    29  **********
 351    2019-12-19 19:12    28  *********
 ...    ..( 33 skipped).    ..  *********
 385    2019-12-19 19:46    28  *********
 386    2019-12-19 19:47     ?  -
 387    2019-12-19 19:48    23  ****
 388    2019-12-19 19:49    24  *****
 389    2019-12-19 19:50    25  ******
 390    2019-12-19 19:51    26  *******
 391    2019-12-19 19:52    26  *******
 392    2019-12-19 19:53    26  *******
 393    2019-12-19 19:54    27  ********
 394    2019-12-19 19:55    27  ********
 395    2019-12-19 19:56    28  *********
 396    2019-12-19 19:57    28  *********
 397    2019-12-19 19:58    29  **********
 398    2019-12-19 19:59    29  **********
 399    2019-12-19 20:00    28  *********
 400    2019-12-19 20:01    29  **********
 ...    ..(  4 skipped).    ..  **********
 405    2019-12-19 20:06    29  **********
 406    2019-12-19 20:07     ?  -
 407    2019-12-19 20:08    20  *
 408    2019-12-19 20:09    22  ***
 409    2019-12-19 20:10    23  ****
 410    2019-12-19 20:11    24  *****
 411    2019-12-19 20:12    24  *****
 412    2019-12-19 20:13    25  ******
 413    2019-12-19 20:14    26  *******
 414    2019-12-19 20:15    27  ********
 415    2019-12-19 20:16    28  *********
 416    2019-12-19 20:17    28  *********
 417    2019-12-19 20:18    29  **********
 418    2019-12-19 20:19    29  **********
 419    2019-12-19 20:20    30  ***********
 420    2019-12-19 20:21    31  ************
 421    2019-12-19 20:22    30  ***********
 ...    ..(  7 skipped).    ..  ***********
 429    2019-12-19 20:30    30  ***********
 430    2019-12-19 20:31    29  **********
 431    2019-12-19 20:32    30  ***********
 432    2019-12-19 20:33    30  ***********
 433    2019-12-19 20:34    30  ***********
 434    2019-12-19 20:35     ?  -
 435    2019-12-19 20:36    24  *****
 436    2019-12-19 20:37    25  ******
 437    2019-12-19 20:38    26  *******
 438    2019-12-19 20:39    27  ********
 439    2019-12-19 20:40    27  ********
 440    2019-12-19 20:41    28  *********

SCT Error Recovery Control:
           Read: Disabled
          Write: Disabled

Device Statistics (GP Log 0x04)
Page  Offset Size        Value Flags Description
0x01  =====  =               =  ===  == General Statistics (rev 2) ==
0x01  0x008  4            3178  ---  Lifetime Power-On Resets
0x01  0x010  4            3990  ---  Power-on Hours
0x01  0x018  6     13164573969  ---  Logical Sectors Written
0x01  0x020  6       271231448  ---  Number of Write Commands
0x01  0x028  6     19696041427  ---  Logical Sectors Read
0x01  0x030  6       295636918  ---  Number of Read Commands
0x02  =====  =               =  ===  == Free-Fall Statistics (rev 1) ==
0x02  0x010  4            1501  ---  Overlimit Shock Events
0x03  =====  =               =  ===  == Rotating Media Statistics (rev 1) ==
0x03  0x008  4            1246  ---  Spindle Motor Power-on Hours
0x03  0x010  4            3421  ---  Head Flying Hours
0x03  0x018  4          148398  ---  Head Load Events
0x03  0x020  4              80  ---  Number of Reallocated Logical Sectors
0x03  0x028  4               0  ---  Read Recovery Attempts
0x03  0x030  4               0  ---  Number of Mechanical Start Failures
0x04  =====  =               =  ===  == General Errors Statistics (rev 1) ==
0x04  0x008  4               0  ---  Number of Reported Uncorrectable Errors
0x04  0x010  4            5221  ---  Resets Between Cmd Acceptance and Completion
0x05  =====  =               =  ===  == Temperature Statistics (rev 1) ==
0x05  0x008  1              28  ---  Current Temperature
0x05  0x010  1              30  N--  Average Short Term Temperature
0x05  0x018  1              31  N--  Average Long Term Temperature
0x05  0x020  1              44  ---  Highest Temperature
0x05  0x028  1              13  ---  Lowest Temperature
0x05  0x030  1              39  N--  Highest Average Short Term Temperature
0x05  0x038  1              23  N--  Lowest Average Short Term Temperature
0x05  0x040  1              31  N--  Highest Average Long Term Temperature
0x05  0x048  1              27  N--  Lowest Average Long Term Temperature
0x05  0x050  4               0  ---  Time in Over-Temperature
0x05  0x058  1              55  ---  Specified Maximum Operating Temperature
0x05  0x060  4               0  ---  Time in Under-Temperature
0x05  0x068  1               5  ---  Specified Minimum Operating Temperature
0x06  =====  =               =  ===  == Transport Statistics (rev 1) ==
0x06  0x008  4          476825  ---  Number of Hardware Resets
0x06  0x018  4            2945  ---  Number of Interface CRC Errors
0x07  =====  =               =  ===  == Solid State Device Statistics (rev 1) ==
0x07  0x008  1               6  N--  Percentage Used Endurance Indicator
                                |||_ C monitored condition met
                                ||__ D supports DSN
                                |___ N normalized value

SATA Phy Event Counters (GP Log 0x11)
ID      Size     Value  Description
0x0001  4            0  Command failed due to ICRC error
0x0002  4            0  R_ERR response for data FIS
0x0003  4            0  R_ERR response for device-to-host data FIS
0x0004  4            0  R_ERR response for host-to-device data FIS
0x0005  4            0  R_ERR response for non-data FIS
0x0006  4            0  R_ERR response for device-to-host non-data FIS
0x0007  4            0  R_ERR response for host-to-device non-data FIS
0x0008  4            0  Device-to-host non-data FIS retries
0x0009  4            3  Transition from drive PhyRdy to drive PhyNRdy
0x000a  4            0  Device-to-host register FISes sent due to a COMRESET
0x000b  4            0  CRC errors within host-to-device FIS
0x000d  4            0  Non-CRC errors within host-to-device FIS
0x000f  4            0  R_ERR response for host-to-device data FIS, CRC
0x0010  4            0  R_ERR response for host-to-device data FIS, non-CRC
0x0012  4            0  R_ERR response for host-to-device non-data FIS, CRC
0x0013  4            0  R_ERR response for host-to-device non-data FIS, non-CRC

